{
  "id": "diag-ccsa-20260903",
  "setor": "CCSA — Direção de Centro",
  "setor_codigo": "S07-CCSA",
  "sigla": "CCSA",
  "data": "2026-09-03T02:00:00Z",
  "modelo": "claude-sonnet (subagente construtor)",
  "versao_diretrizes": "1.0",
  "fontes_entradas": [
    "pb-ccsa",
    "1780963200012"
  ],
  "hash_fontes": "ad8ee7601b832c7d1c0ca33cef3a5ad10e321dfc6a90e8848768f93379a40f29",
  "ecossistema": {
    "dominio": "Ensino, Pesquisa e Extensão (Centro)",
    "subdominios": [
      "Articulação e governança do Centro",
      "Gestão da base de contatos por função (colegiados e núcleos)",
      "Encaminhamento e acompanhamento de demandas via e-Protocolo"
    ],
    "contextos_vizinhos": [
      "Colegiado de Curso",
      "Direção de Centro (competências gerais)",
      "CECE — Direção de Centro",
      "Direção Geral de Campus"
    ],
    "sistemas": [
      "e-Protocolo"
    ],
    "normas": [
      "Estatuto (Res. 017/99-COU) art. 37 e 41"
    ],
    "benchmarks": []
  },
  "processos": [
    {
      "codigo_sugerido": "CCSA-00",
      "nome": "Visão geral — CCSA — Direção de Centro",
      "tipo": "processo",
      "descricao": "Articulação da Direção do Centro de Ciências Sociais Aplicadas com os colegiados de Administração, Ciências Contábeis, Direito, Hotelaria e Turismo e com os núcleos NPJ, NUTUR e NUPESA, manutenção da base de contatos por função e encaminhamento e acompanhamento das demandas do Centro.",
      "tipo_subdominio": "core",
      "gatilho": "Necessidade de articulação com colegiados/núcleos, atualização da base de contatos ou encaminhamento de demanda do Centro",
      "saida": "Base de contatos atualizada e demandas do Centro encaminhadas e acompanhadas até a resposta",
      "atores": [
        "Diretor(a) de Centro",
        "Coordenador(a) de Curso"
      ],
      "sistemas": [
        "e-Protocolo"
      ],
      "artefatos": [
        "Lista de contatos por função do CCSA",
        "Ofício/memorando de encaminhamento de demanda do Centro"
      ],
      "interfaces": [
        "Colegiado de Curso",
        "Direção Geral de Campus"
      ],
      "evidencias": [
        "pb-ccsa",
        "1780963200012"
      ],
      "maturidade": 3,
      "criticidade": 0.7,
      "frequencia": 0.7,
      "risco_conformidade": 0.5,
      "cobertura": 0.75,
      "prioridade": 0.62,
      "lacunas": [
        "formulario",
        "dados_pessoais_lgpd"
      ],
      "recomendacao": "coletar_mais",
      "pop_existente": "pop-ccsa-00",
      "justificativa": "POP completado nesta rodada (v1.0.0, em_validação) com 6 passos, responsável, decisão, KPIs, contingência e mapa de contexto, a partir da lista de contatos dos colegiados e núcleos do Centro; restam a política de tratamento dos dados pessoais de contato e a confirmação das siglas dos núcleos (NPJ, NUTUR, NUPESA) antes da promoção a 'aprovado'."
    }
  ],
  "lacunas_setor": [
    "Política de acesso e atualização da lista de contatos (dados pessoais) não formalizada",
    "Periodicidade de validação dos contatos dos colegiados e núcleos não normatizada",
    "Siglas dos núcleos (NPJ, NUTUR, NUPESA) não expandidas nas fontes consultadas"
  ],
  "licoes_propostas": [
    {
      "licao": "Núcleos e mestrados citados apenas pela sigla, sem expansão no material de origem, geram ambiguidade no glossário do POP.",
      "regra": "Ao lançar no glossário uma sigla local sem confirmação expressa da fonte, registrar 'sigla não expandida nas fontes consultadas — a confirmar' em vez de presumir o significado.",
      "exemplo": "CCSA-00 — termos NPJ, NUTUR e NUPESA",
      "origem": "diagnostico"
    }
  ],
  "observacoes": "As rotinas específicas de gestão acadêmica, estágio e TCC de cada colegiado do CCSA são tratadas no POP transversal COLEG-00 (e nos processos derivados COLEG-01 a COLEG-04, ver diagnóstico COLEG); este diagnóstico cobre apenas a articulação e a governança da Direção de Centro do CCSA."
}
