{
  "id": "diag-dinf-20260903",
  "setor": "Div. de Informática",
  "setor_codigo": "S03.03-DINF",
  "sigla": "DINF",
  "data": "2026-09-03T01:59:01Z",
  "modelo": "claude-sonnet (subagente construtor)",
  "versao_diretrizes": "1.0",
  "fontes_entradas": [
    "pb-informatica"
  ],
  "hash_fontes": "bf9237f7bcefe5770d260988113061b1398300ce26fd98f565f1620bcb21888b",
  "ecossistema": {
    "dominio": "Tecnologia da Informação",
    "subdominios": [
      "A definir (playbook em construção)"
    ],
    "contextos_vizinhos": [
      "A definir"
    ],
    "sistemas": [],
    "normas": [],
    "benchmarks": []
  },
  "processos": [
    {
      "codigo_sugerido": "DINF-00",
      "nome": "Visão geral — Div. de Informática (roteiro de coleta)",
      "tipo": "processo",
      "descricao": "Setor sem mapeamento de processos no Canvas; o único registro é o playbook-esqueleto genérico apontando para o levantamento inicial de atividades, fluxos e normas aplicáveis.",
      "tipo_subdominio": "suporte",
      "gatilho": "A definir",
      "saida": "A definir",
      "atores": [
        "A definir"
      ],
      "sistemas": [],
      "artefatos": [],
      "interfaces": [],
      "evidencias": [
        "pb-informatica"
      ],
      "maturidade": 0,
      "criticidade": 0.4,
      "frequencia": 0.3,
      "risco_conformidade": 0.4,
      "cobertura": 0.05,
      "prioridade": 0.43,
      "lacunas": [
        "responsavel",
        "normativa",
        "gatilho",
        "entrada",
        "saida",
        "passos",
        "sistema",
        "formulario",
        "prazo",
        "kpi",
        "contingencia",
        "interface_setorial"
      ],
      "recomendacao": "coletar_mais",
      "pop_existente": "DINF-00",
      "justificativa": "Nenhuma entrada real do Canvas além do playbook-esqueleto genérico; o POP foi tratado como roteiro de coleta (contingência e checklist de levantamento), mantendo o status rascunho até que os serviços de TI/suporte técnico sejam mapeados."
    }
  ],
  "lacunas_setor": [
    "sem entradas no Canvas"
  ],
  "licoes_propostas": [],
  "observacoes": "Setor ainda não mapeado — roteiro de coleta (mesmo padrão de DST, DPAT, DATL e DSA; ver lição proposta em diagnosticos/DST.json)."
}
