{
  "id": "diag-con-20260903",
  "setor": "ATDG — Assessoria Técnica da Direção Geral",
  "setor_codigo": "S02.01-CON",
  "sigla": "CON",
  "data": "2026-09-03T02:02:00Z",
  "modelo": "claude-sonnet (subagente construtor)",
  "versao_diretrizes": "1.0",
  "fontes_entradas": [],
  "hash_fontes": "e3b0c44298fc1c149afbf4c8996fb92427ae41e4649b934ca495991b7852b855",
  "ecossistema": {
    "dominio": "Convênios, Parcerias e Captação",
    "subdominios": [
      "Instrução de Convênio",
      "Celebração de Convênio",
      "Execução de Convênio",
      "Prestação de Contas de Convênio",
      "Encerramento de Convênio"
    ],
    "contextos_vizinhos": [
      "Direção Geral do Campus",
      "Setor demandante",
      "SETI",
      "TCE-PR"
    ],
    "sistemas": [
      "e-Protocolo",
      "OneDrive ATDG"
    ],
    "normas": [
      "Lei nº 14.133/2021 (Lei de Licitações e Contratos Administrativos), no que for pertinente à formalização de convênios"
    ],
    "benchmarks": []
  },
  "processos": [
    {
      "codigo_sugerido": "CON-04",
      "nome": "Prestação de Contas de Convênio",
      "tipo": "processo",
      "descricao": "Prestação de Contas de Convênio — financeira e técnica, TCE-PR.",
      "tipo_subdominio": "core",
      "gatilho": "Encerramento da vigência ou do objeto do convênio, exigindo prestação de contas",
      "saida": "Prestação de contas aprovada e disponível ao TCE-PR",
      "atores": [
        "Setor demandante",
        "Assessoria Técnica da Direção Geral (ATDG)",
        "Direção Geral do Campus",
        "TCE-PR"
      ],
      "sistemas": [
        "e-Protocolo"
      ],
      "artefatos": [
        "Prestação de contas financeira e técnica",
        "Planilha de conferência financeira"
      ],
      "interfaces": [
        "Direção Geral do Campus",
        "TCE-PR"
      ],
      "evidencias": [],
      "maturidade": 0,
      "criticidade": 0.9,
      "frequencia": 0.4,
      "risco_conformidade": 0.9,
      "cobertura": 0.15,
      "prioridade": 0.72,
      "lacunas": [
        "responsavel",
        "kpi",
        "formulario",
        "prazo",
        "normativa"
      ],
      "recomendacao": "gerar_pop",
      "pop_existente": "pop-con-04",
      "justificativa": "Processo de maior risco de conformidade do subdomínio (TCE-PR); sem entradas do Canvas, playbook construído por inferência (minor, rascunho), prioridade alta para validação com a ATDG."
    },
    {
      "codigo_sugerido": "CON-01",
      "nome": "Instrução de Convênio",
      "tipo": "processo",
      "descricao": "Instrução de Convênio — pré-aprovação, documentação e encaminhamento à SETI.",
      "tipo_subdominio": "core",
      "gatilho": "Manifestação de interesse do setor demandante em celebrar convênio, ou publicação de edital/chamamento que enseje convênio",
      "saida": "Processo de convênio instruído, pré-aprovado e encaminhado à SETI",
      "atores": [
        "Setor demandante",
        "Assessoria Técnica da Direção Geral (ATDG)",
        "Direção Geral do Campus",
        "SETI"
      ],
      "sistemas": [
        "e-Protocolo"
      ],
      "artefatos": [
        "Plano de trabalho",
        "Minuta de convênio"
      ],
      "interfaces": [
        "Direção Geral do Campus",
        "SETI"
      ],
      "evidencias": [],
      "maturidade": 0,
      "criticidade": 0.8,
      "frequencia": 0.5,
      "risco_conformidade": 0.7,
      "cobertura": 0.18,
      "prioridade": 0.67,
      "lacunas": [
        "responsavel",
        "kpi",
        "formulario",
        "prazo",
        "normativa"
      ],
      "recomendacao": "coletar_mais",
      "pop_existente": "pop-con-01",
      "justificativa": "Escopo evidenciado apenas pelo manual institucional da ATDG (jun/2026), sem entradas do Canvas; playbook construído por inferência (minor, rascunho), pendente de validação da ATDG."
    },
    {
      "codigo_sugerido": "CON-03",
      "nome": "Execução de Convênio",
      "tipo": "processo",
      "descricao": "Execução de Convênio — acompanhamento e relatórios parciais.",
      "tipo_subdominio": "core",
      "gatilho": "Convênio celebrado e vigente, com execução do objeto em curso",
      "saida": "Relatório parcial de execução aprovado e acompanhamento atualizado",
      "atores": [
        "Setor demandante",
        "Assessoria Técnica da Direção Geral (ATDG)",
        "SETI"
      ],
      "sistemas": [
        "e-Protocolo",
        "OneDrive ATDG"
      ],
      "artefatos": [
        "Relatório parcial de execução",
        "Registro de acompanhamento do convênio"
      ],
      "interfaces": [
        "SETI"
      ],
      "evidencias": [],
      "maturidade": 0,
      "criticidade": 0.75,
      "frequencia": 0.55,
      "risco_conformidade": 0.7,
      "cobertura": 0.18,
      "prioridade": 0.67,
      "lacunas": [
        "responsavel",
        "kpi",
        "formulario",
        "prazo",
        "normativa"
      ],
      "recomendacao": "coletar_mais",
      "pop_existente": "pop-con-03",
      "justificativa": "Sem entradas do Canvas; playbook construído por inferência a partir do escopo do manual institucional (minor, rascunho)."
    },
    {
      "codigo_sugerido": "CON-02",
      "nome": "Celebração de Convênio",
      "tipo": "processo",
      "descricao": "Celebração de Convênio — assinaturas, publicação e registro.",
      "tipo_subdominio": "core",
      "gatilho": "Aprovação da minuta de convênio pela SETI recebida",
      "saida": "Convênio assinado, publicado e registrado",
      "atores": [
        "Assessoria Técnica da Direção Geral (ATDG)",
        "Direção Geral do Campus",
        "SETI",
        "Setor demandante"
      ],
      "sistemas": [
        "e-Protocolo",
        "OneDrive ATDG"
      ],
      "artefatos": [
        "Convênio (instrumento assinado)",
        "Registro de convênios"
      ],
      "interfaces": [
        "Direção Geral do Campus",
        "SETI",
        "Setor demandante"
      ],
      "evidencias": [],
      "maturidade": 0,
      "criticidade": 0.8,
      "frequencia": 0.45,
      "risco_conformidade": 0.7,
      "cobertura": 0.15,
      "prioridade": 0.66,
      "lacunas": [
        "responsavel",
        "kpi",
        "formulario",
        "prazo",
        "normativa"
      ],
      "recomendacao": "coletar_mais",
      "pop_existente": "pop-con-02",
      "justificativa": "Sem entradas do Canvas; playbook construído por inferência a partir do escopo do manual institucional (minor, rascunho)."
    },
    {
      "codigo_sugerido": "CON-05",
      "nome": "Encerramento de Convênio",
      "tipo": "processo",
      "descricao": "Encerramento de Convênio — baixa, arquivo e lições aprendidas.",
      "tipo_subdominio": "core",
      "gatilho": "Prestação de contas aprovada e convênio pronto para baixa e arquivamento",
      "saida": "Convênio baixado e arquivado, com lições aprendidas registradas",
      "atores": [
        "Assessoria Técnica da Direção Geral (ATDG)",
        "Setor demandante",
        "Direção Geral do Campus"
      ],
      "sistemas": [
        "e-Protocolo",
        "OneDrive ATDG"
      ],
      "artefatos": [
        "Registro de lições aprendidas do convênio",
        "Processo de convênio arquivado"
      ],
      "interfaces": [
        "Setor demandante",
        "Direção Geral do Campus"
      ],
      "evidencias": [],
      "maturidade": 0,
      "criticidade": 0.6,
      "frequencia": 0.3,
      "risco_conformidade": 0.6,
      "cobertura": 0.15,
      "prioridade": 0.54,
      "lacunas": [
        "responsavel",
        "kpi",
        "formulario",
        "prazo",
        "normativa"
      ],
      "recomendacao": "coletar_mais",
      "pop_existente": "pop-con-05",
      "justificativa": "Sem entradas do Canvas; playbook construído por inferência a partir do escopo do manual institucional (minor, rascunho)."
    }
  ],
  "lacunas_setor": [
    "sem entradas no Canvas"
  ],
  "licoes_propostas": [],
  "observacoes": "Diagnóstico do lote CON (5 processos), sem entradas do Canvas Vivo para este subdomínio. Escopos derivados do manual institucional da ATDG (jun/2026) e da prática administrativa geral de convênios em universidades estaduais do Paraná. Playbooks elaborados por inferência (tipo_mudanca minor, status permanece rascunho), com responsável do processo, prazos, formulários, KPIs e normativa específica marcados como lacunas pendentes de validação com a ATDG."
}
